ISBN,TITLE,AUTHORS,YEAR,PUBLISHER,GENRE,DESCRIPTION,PAGE_COUNT,LANGUAGE,AVG_RATING,RATINGS_COUNT
9780385414791,Hopes and Impediments,Chinua Achebe,1990,Penguin Books,Biography & Autobiography,The author's critical writings over the past twenty-five years use his creative energies to expose the monster of racist habit and offer a new perspective on the human condition.,212,en,,
9781557484550,Devotions for Dieters,Dan R. Dick,1994,Barbour Publishing,,,164,en,,
9780895778345,Natural Remedies,,1995,,Family & Relationships,Introduces readers to therapies that can help them prevent illness and achieve and maintain good health and a sense of well-being. Explains individual therapies and techniques used by practitioners.,168,en,,
9780373201198,Dream Catchers,"Kathleen Eagle, Bronwyn Williams",1996,Harlequin Books,Fiction,"Dream Catchers by Kathleen Eagle\Bronwyn Williams released on Nov 24, 1995 is available now for purchase.",600,en,,
9780879722258,The World of Mystery Fiction,Elliot L. Gilbert,1983,,Detective and mystery stories,"Includes mystery stories by Vidocq, Charles Dickens, Edgar Allan Poe, Arthur Conan Doyle, G.K. Chesterton, Dorothy L. Sayers, Ellery Queen, Georges Simenon, Dashiell Hammett, Raymond Chandler, Cornell Woolrich, Ross Macdonald, Agatha Christie, and Jorge Luis Borges.",494,en,,
9780671022839,Black Cabs,John McLaren,2000,,Fiction,"The high-flyers of London's investment banks are all too aware that information is gold-dust when billion pound deals are at stake. But as the highly-paid guns at Skidder Barton, a fading giant in the cut-throat corporate finance sector, secretly plot the huge take-over that will revive their fortunes, they forget that there's one place they can be overheard ... Len and his cabbie colleagues, Terry and Einstein, embark on a cunning and dangerous attempt to profit from the next big take-over move. Because Len needs the money, and he needs it fast - his daughter's life depends on it. Will the cabbies' world of solidarity triumph over the brutal self-interest of the sharp suits who will stop at nothing on the road to unimaginable riches?",404,en,,
9780689820380,Vacation!,Molly Wigand,1998,Simon & Schuster,Juvenile Nonfiction,"The Rugrat babies are off on a road trip to end all road trips when they take a vacation to the glitz and glamour that is Las Vegas, where they help to free some kitties--tigers--from the ""Heimlich and Bob Show.""",36,en,,
9783522172547,"Martin, der Krieger.",Brian Jacques,2001,,,,461,de,,
9781559704991,Theo's Odyssey,Catherine Clément,1999,Arcade Publishing,Fiction,"An international bestseller being published in more than 20 countries, ""Theo's Odyssey"" is an extraordinary journey through the world's religions that does for spirituality what ""Sophie's World"" did for philosophy.",614,en,5,1
9781862045026,Numerology,Sonia Ducie,1999,"Element Books, Limited",Numerology,,0,en,,
9781565270787,"Lotus 1-2-3, Release 2.4 for Business",Roy Ageloff,1993,,Computers,,684,en,,
9780671011390,Hellion,Gloria Dale Skinner,1998,Pocket Books,Colorado,"Taught by her three brothers, Rosellen Lattimer can outride, outshoot, and outsmart any man. But when Carson Murdock crosses her path, Rosellen discovers one thing she's never learned: what it means to be a woman.",0,en,,
9780882906232,The War to Save Our Kids,Richard Powell Lindsay,1998,,Family & Relationships,,146,en,,
9780312782153,The TV Theme Song Sing-Along Songbook,John Javna,1984,St. Martin's Griffin,Performing Arts,"Now YOU can sing these all-time great TV Themes: Mr. Ed, The Beverly Hillbillies, Secret Agent, Laverne and Shirley, Green Acres, The Brady Bunch, Maverick, Dobie Gillis, 77 Sunset Strip, Courtship of Eddies Father, The Roy Rogers Show, Cheyenne, Happy Days, Casper The Friendly Ghost, Dragnet, Hawaiian Eye, The Addams Family, Petticoat Junction, Welcome Back Kotter, All in the Family, Mighty Mouse, I Married Joan, The Jeffersons, Felix the Cat, Wyatt Earp, George of the Jungle, Beany and Cecil, Popeye, Perry Mason and More! Leave the unknown lyrics to the themes from: Star Trek, Leave It to Beaver, Bonanza, I Love Lucy, The Andy Griffith Show and More!! Plus: Plot Summaries Vital Statistics and... Special Bonus! Your All-Time Favorite Commerical Songs!",128,en,,
9783627000653,Liebeslohn,Olivia Kleinknecht,1998,FVA-Frankfurter Verlagsanstalt GmbH,,,268,de,,
9789879460061,E- commerce,"Craig Fellenstein, Ron Wood",2000,,Electronic commerce,,318,es,,
9780806517773,The Wicca Garden,Gerina Dunwich,1996,Citadel Press,Gardening,ants,212,en,4,1
9780553262636,The Voice That Is Great Within Us,Hayden Carruth,1983,Bantam,Poetry,"“What an achievement, these sixty years of poetry! In whatever terms we Americans regard the rest of our recent history, the score of things done well and done ill, this much at least we have done superlatively.”—Hayden Carruth This famous anthology includes the works of more than 130 major American poets of the modern period—Robert Frost, Paul Goodman, Carl Sandburg, T.S. Eliot, Ezra Pound, Allen Ginsberg, and Gwendolyn Brooks among them—along with short biographies of each. “Not only the best on its period, I think, but is even perhaps safe from the competition of rivals.”—Robert Lowell",770,en,,
9782070767106,Après l'empire,Emmanuel Todd,2002,Editions Gallimard,Geopolitics,"Analyse le relatif déclin de l'empire américain après l'hégémonie des années 1950-1990, clef pour comprendre sa politique étrangère actuelle. En perte de puissance économique, le but stratégique n'est plus de défendre un ordre démocratique et libéral, mais de contrôler les ressources mondiales.",246,fr,,
9780917197031,One Hundred and One Ways to Feed the Heart,Denny Johnson,1985,,Emotions,,164,en,,
9780679725268,The Scarlet Letter,Nathaniel Hawthorne,1990,Vintage,Fiction,"Set in the harsh Puritan community of 17th century Massachusetts, this tale of an adulterous entanglement resulting in an illegitimate birth engendered the first true heroine of American fiction.",276,en,,
9780439316750,Stargirl,Jerry Spinelli,2002,,Arizona,"A story about the perils of popularity, the courage to be unique, the thrill of first love, and how an eccentric student named Stargirl changes Mica High School forever.",200,en,,
9781561795970,Summer Promise,Robin Jones Gunn,1998,,Fiction,A collection of previously published books featuring Wisconsin farm girl Christy Miller as she learns about Christianity and life.,180,en,4.5,3
9780440123040,The Empire Builders,William Stuart Long,1987,Dell Publishing Company,Fiction,"During the 1860s, Australia settlers--including officer Adam Vincent and Lady Kitty Broome--set out to claim the frontier of New Zealand for the British Empire, despite the fierce resistance of the native Maoris and Hauhaus",448,en,,
9780553102352,In Pursuit of the Proper Sinner,Elizabeth George,1999,Bantam,Fiction,"Calder Moor is a wild and deadly place: many have been trapped in the myriad limestone caves, lost in collapsed copper mines, injured on perilous gritstone ridges. But this time, when two bodies are discovered in the shadow of the ancient circle of stones known as Nine Sisters Henge, it is clearly not a case for Mountain Rescue. The corpses are those of a young man and woman. Each met death in a different fashion. Each died violently. To Detective Inspector Thomas Lynley, brought in to investigate by special request, this grisly crime promises to be one of the toughest assignments of his career. For the unfortunate Nicola Maiden was the daughter of a former officer in an elite undercover unit, a man Lynley once regarded as a mentor. Now, as Lynley struggles to find out if Nicola's killer was an enemy of her father's or one she earned herself, a disgraced Barbara Havers, determined to redeem herself in the eyes of her longtime partner, crisscrosses London seeking information on the second murder victim. Yet the more dark secrets Lynley and Havers uncover, the more they learn that neither the victims nor the suspects are who they appear to be. And once again they come up against the icy realization that human relationships are often murderous...and that the blood that binds can also kill.",616,en,,
9780374134389,Daddyji,Ved Mehta,1972,Farrar Straus Giroux,Biography & Autobiography,"Biographical portrait of the author's father Amolak Ram Mehta (Daddyji), b. 1895, distinguished Indian public health officer.",230,en,,
9780590447751,Shipwrecked,B. B. Hiller,1991,Scholastic Paperbacks,Juvenile Fiction,"When 14 year old Haakon Haakonsen became ship's boy on the Flora, he wanted to earn money to save his family's farm in Norway. He never dreamed of the adventure that was in waiting for him, which included pirates, hijackings, stowaways, and shipwrecks.",140,en,,
9780425194294,The Magyar Venus,Lyn Hamilton,2004,Berkley Hardcover,Antique dealers,"The discovery of a 25,000-year-old archaeological treasure, a rekindled romance, and a suspicious suicide send Toronto antiques dealer Lara McClintoch on a quest to the city of Budapest.",0,en,,
9780064409094,The Nightmare Room #11: Scare School,R.L. Stine,2001,HarperCollins,Juvenile Fiction,"There's something lurking in the halls of Wilton Middle School. Something with fur...and claws...and long, sharp teeth. Something absolutely terrifying. And it doesn't like new kids.",160,en,,
9783423201605,Jenseits von Pu und Böse,John Tyerman Williams,1998,,,,236,de,,
9780553353389,Dreams and Delusions,Mari Hanes,1991,Bantam,Psychology,"The author of The Child Within probes the impact of women's romantic fantasies on their lives and the constructive uses of imagination. Drawing on ten years of research and 10,000 responses to a survey in Virtue magazine, Mari Hanes discusses common fantasies and the needs they express, negative fantasies, and healthy daydreams.",262,en,,
9789500722773,Mamá,Jorge Fernández Díaz,2002,,"Authors, Argentine","Una campesina espanola envia a su hija de 15 anos a la Argentina de Peron. Quiere sacarla de la miseria y le promete que pronto la seguira toda su familia. Pero algo falla y nadie viene, y la chica se queda atrapada en un pais hostil donde crece, se casa, lucha contra su destino y sufre el destierro mas cruel. Luego de muchos anos deja de sufrir y se hace argentina. Entonces sus hijos y nietos le anuncian que quieren irse a vivir a Espana, huyendo de la depresion economica, y todo vuelve a empezar. Esta historia se convierte en libro el dia que su hijo, editor y periodista, advierte un hecho estremecedor: las experiencias de su madre hacen llorar a la psicologa que la atiende. Decide entonces entrevistar a ""mama, "" la escucha durante mas de cincuenta horas y luego reconstruye este relato emocionante y lucido, que plantea el gran dilema actual, y de todos los tiempos: irse o quedarse.",228,es,,
9780374135652,The Death of Napoleon,Simon Leys,1992,Farrar Straus & Giroux,Fiction,"When the imposter he has left on St. Helena dies and the news of his death reaches Europe, Napoleon, traveling incognito, must come to terms with his loss of identity",129,en,,
9780921165248,Tales Out of School,Scanlon,1992,"Carp, Ont. : Creative Bound",Fiction,,188,en,,
9780375724626,Up at the Villa,William Somerset Maugham,1977,,British,,209,en,,
9780528876851,Misty of Chincoteague,Marguerite Henry,1970,,Chincoteague Island (Va.),Two youngsters' determination to own a Chincoteague pony is greatly increased when the Phantom and her colt are among those rounded up for the yearly auction.,173,en,,
9780679783824,Research Paper Smart,"Liz Buffa, Princeton Review (Firm)",1997,Princeton Review,Academic writing,"Each year thousands of college freshmen must research and write a term paper. For many, this will be a first-time experience. ""Research Paper Smart"" is the one-stop resource for students who want to know how to research, how to reference, and ultimately how to write a college-level paper.",0,en,,
9783359014782,"Tobe, zürne, misch dich ein!",Konstantin Wecker,2003,,Baghdad (Iraq),,228,de,,
9780515082494,Rebels in Love,Shana Carrol,1985,Jove Publications,Fiction,"Colleen McClagan, a lovely rebel running an underground newspaper and musician Jason Paxton risk their lives and love in the cause of American independence from Britain in Charleston",378,en,,
9780890437230,Consumer Reports Mutual Funds Book,Greg Daugherty,1994,,Business & Economics,"Mutual funds have grown increasingly popular during the last 10 years, and the options available to the consumer have increased so greatly that even experienced investors may be confused. This user's manual provides a clear-cut, jargon-free blueprint for investors that's tailored to different incomes and life stages.",200,en,,
9780140159691,Secret Dossier,"Pierre Salinger, Eric Laurent",1991,Penguin Mass Market,History,FROST (Copy 1): From the John Holmes Library Collection.,258,en,,
9788445072790,Las llaves del aire,Ursula K. Le Guin,1998,,"Fantasy fiction, American",Eighteen short stories reveal the strangeness that can be found in ordinary life.,0,es,,
9781880559581,The Artist's Resource Handbook,Daniel Grant,1996,,Art,"This guide explains how artists can benefit from resources at little or no cost. Included is a list of organizations that offer career advice, a list of source materials, advice on working with umbrella organizations, how to obtain free or discounted material, and technical assistance.",264,en,,
9781562450403,Women on Men,Marlene Rimler,1993,Great Quotations,Poetry,,172,en,,
9780373291847,My Lady de Burgh,Deborah Simmons,2001,Harlequin Books,Fiction,"My Lady De Burgh by Deborah Simmons released on Oct 25, 2001 is available now for purchase.",308,en,,
9780174435662,Romeo and Juliet,William Shakespeare,2000,A & C Black,,Romeo and Juliet was the first drama in English to confer full tragic dignity on the agonies of youthful love. The lyricism that enshrines their death-marked devotion has made the lovers legendary in every language that possesses a literature.,,en,,
9780553237689,Six of One,Rita Mae Brown,1979,Bantam,Fiction,"Whether careening through town propelling cars like long-range missiles, or laying waste to a costumed July Fourth parade, Wheezie and Juts Hunsenmeir are Runnymede's most irrepressible, mule-headed sister scat. together these unrivaled Southern siblings cheerfully raise hell-and a hell of a family-among some of the most colorful townsfolk you're ever likely to meet. Chief among them is elegant Celeste Chalfonte. As exquisite as she is fearless, Celeste kills a man and marries a woman, sloe-eyed Ramelle Bowman. And when Ramelle has Curtis Chalfronte's child, no one bats an eye-even though Ramelle has no intention of leaving her beloved Celeste. Then there's Fannie Jump Creighton who runs a speakeasy in her mansion. And activist Fairy Thatcher, who disappears into Hitler's Germany. Through it all run Wheezie and Juts, heading pell-mell into the future with their hands firmly gripped around each other's throats. spanning more than fifty years of the tumultuous twentieth century, ""Six of One is a joyous celebration of the human sprit-and the ties binding even the unlikeliest families.",356,en,,
9780825424953,Sassy Cinderella and the Valiant Vigilante,Sharon Dunn,2003,Ruby Taylor Mysteries,Fiction,Ruby Taylor's job at the university turns interesting and it isn't long before she's in a crash course on real love and deadly university politics. It's a mystery with more twists than a silly straw. This award-winning title is guaranteed fiction!,0,en,,
9781590580486,Mesozoic Murder,Christine Gentry,2011,Poisoned Pen Press,Fiction,"Ansel Phoenix makes her living drawing dinosaurs for magazines, books, and museum displays. One morning, digging with students out in the field, she unearths the body of colleague and ex-lover Nick Capos. Shocked and grieved over the murder, Ansel is also distraught on a professional level. As president of the Pangaea Society, an esteemed paleontology organization to which the murdered botanist had also belonged, Ansel must fight to preserve the society’s reputation when unsavory facts about its scientists—dead and alive—are revealed. Not trusting the Big Toe police who’ve an axe to grind with her father, she decides to investigate what Capos had been doing during the last few months of his life and soon suspects he was working on a secret, possibly illegal, project worth killing for. Her list of possible suspects grows by the hour as someone starts stalking her across the Montana landscape. This master predator will stop at nothing to keep her from discovering...what? Why is Nick’s fossil collection missing and why had he developed a recent interest in Baltic amber? Ansel must also deal with the cultural challenges of her own half-Anglo, half-Blackfoot heritage, with her ranching family, and with the changes threatening their rural community while using her intuitive fossil-sleuthing skills to solve more than one Mesozoic mystery.",296,en,,
9780670882168,Home from the Vinyl Cafe,Stuart McLean,1998,,Canada,"A year into the life of Dave, Morley, Stephanie and Sam as they stumble from one fiasco to the next.",256,en,,
9780671578343,The Chrome Borne,"Mercedes Lackey, Larry Dixon",1999,Baen Books,Fiction,"Tannim is a human mage fond of fast cars and loud music, working with the elf lord Keighvin to rescue runaway kids in serious trouble. But those kids are being used by Keighvin' enemies to bait a trap. Meanwhile, Tannim thinks he's found the right woman, but it seems she wants to kill him.",259,en,,
9781567140651,Dangerous Waters,"Marty M. Engle, Johnny Ray Barnes",1996,Frontline Publications,Juvenile Fiction,Something strang is happening in Fairfield. Monsters are real--and the students of Fairfield Junior High know it. They battle the supernatural forces threatening their town.,148,en,,
9780486293509,The Story of Doctor Dolittle,Hugh Lofting,1997,Courier Corporation,Juvenile Fiction,"The adventures of a kind-hearted doctor, who is fond of animals and understands their language, as he travels to Africa with some of his favorite pets to cure the monkeys of a terrible sickness.",100,en,,
9781877961434,The Blood of Roses,Marsha Canham,1990,Knightsbridge Publishing Company,Fiction,The long-awaited sequel to the award-winning The Pride of Lions. Scottish spy and legendary swordsman Alexander Cameron must slip into England to whisk his wife Catherine away to his castle in Scotland--and to know her passionate embrace once more.,614,en,,
9781575668079,Force of Nature,Susan Johnson,2003,Brava,Fiction,"Free-spirited bohemian beauty Jo Attenborough wreaks havoc on the lives of her newfound family when she surrenders to the forbidden passion that rages between her and Flynn Ito, a dangerous and reclusive cattle baron who is the son of a legendary samurai. Original. 70,000 first printing.",308,en,,
9780373256747,Midnight Fantasy,Jasmine Cresswell,1996,Harlequin Books,Fiction,"Midnight Fantasy by Jasmine Cresswell released on Dec 25, 1995 is available now for purchase.",228,en,,
9780399133398,Sacrificial Ground,Thomas H. Cook,1988,Putnam Adult,Fiction,Mystery thriller.,296,en,,
9780195113860,Speaking of Sadness,David Allen Karp,1997,"Depression, Disconnection, and",Medical,"Combining a scholar's care and thoroughness with searing personal insight, Karp brings the private experience of depression into sharp relief, drawing on a remarkable series of intimate interviews with 50 depressed men and women. This important book pierces through the terrifying isolation of depression to uncover the connections linking the depressed as they undertake their personal journeys.",260,en,,
9780441713448,The Remington Factor,Raymond Obstfeld,1985,Ace Books,Fiction,,276,en,,
9780061098000,Midnight Clear,Kathy Hogan Trocheck,1999,Avon,Fiction,"Ex-Atlanta cop-turned-house-cleaning entrepreneur Callahan Garrity doesn't know what she is getting for Christmas, but she never expects the gift that arrives at her door: her estranged, ne'er-do-well brother, Brian, and his adorable three-year-old daughter, Maura. A rebel who's been in and out of trouble most of his life, Brian's deep in it now since he illegally abducted Maura from under the nose of his shrewish former wife. When the beautiful child's mother is found murdered, the police come looking for Brian. And now, to save her brother and her holiday, Callahan -- along with her irascible mom, Edna, and a gaggle of House Mouse employees -- must uncover the truth and a killer, even if it means digging around the roots of her own family tree and exposing the rot underneath.",400,en,,
9780882681979,The Wild Mother,Elizabeth Cunningham,1995,Station Hill Press,,"The delicate relationship growing between Adam Underwood and Eva Brooke is nearly destroyed with the reappearance of his former wife, Lilith.",0,en,,
9788429710328,Mecanoscrit del segon origen,Manuel de Pedrolo,1974,,Foreign Language Study,,184,ca,,
9783442357802,Der Duft der Papaya,Roslyn Carrington,2003,,,,415,de,,
9783596108978,"Rote Sonne, schwarzes Land",Barbara Wood,1992,,British,,765,de,,
9780471135623,The Soup Bible,David Paul Larousse,1997,John Wiley & Sons,Soups,"A professional introduction to the many varieties of soups, their history and preparation, this book includes a history of soups, categories, and cooking techniques, plus 300 recipes. 40 line drawings. of color photos.",0,en,,
9780847807659,All-American Folk Arts and Crafts,William C. Ketchum (Jr.),1989,Rizzoli International Publications,Art,"""Written by a recognized authority in the field and illustrated with many specially commissioned full-color photographs, the book proudly present the spirit of the American nation as it has been expressed by generations of American craftspeople. The nation's symbols--the eagle, the flag, Uncle Sam, Liberty--and its ideals--freedom, home, religion--have been worked and reworked in many dramatic forms for more than two hundred years. Each artist has imbued his work with his generation's understanding of what the country stands for. The variety of forms of patriotic folk art is matched only by the variety of the artists. Painting and sculpture, carved weathervanes and whirligigs, ceramics, quilts and rugs, toys, painted furniture, shop signs, and religious symbols have been created by men and women of all ages and social levels, some working to earn a living, some working only for the joy of creating. Each chapter covers one symbol or ideal and shows how it has been reproduced in various forms that range from home-spun simplicity to ingenious sophistication, evoking the individuality, self-confidence, and optimism that are central to the American experience.""--book jacket.",242,en,,
9780385502627,In a Dark Wood,Amanda Craig,2002,"Random House Digital, Inc.",Fiction,"Interspersing the magic of fairy tales with a wry yet touching narrative, Amanda Craig examines the thin line between fantasy and reality, creativity and mental illness. Benedick Hunter is a recently divorced, out-of-work, thirty-nine-year-old actor. Feeling both guilty and sorry for himself, he blunders through weekends with his two spirited children and fends off various women desperate to snare an eligible man, all the time fearing that he is on the brink of a nervous breakdown. His life takes on a new direction, however, when he discovers a long-forgotten book of fairy tales his mother wrote and illustrated decades earlier. Drawn to its pages, he becomes entranced by the hints of reality embedded in the stories, from thinly veiled portraits of his own father and his parents’ acquaintances to alluring glimpses of his mother as a young woman. Convinced that the stories can explain his mother’s suicide when he was six and put an end to his agonizing mood swings, Benedick embarks on a journey to untangle the past, a journey that eventually takes him to the heart of his own nature, modern fatherhood, manic depression, and the elusive character of fairy-tales. With imagination and incisive wit, Amanda Craig has written a novel that was selected as one of the “best of the year’s books” by theThe Timesof London, which wrote, “Although not frightening enough to give you sleepless nights, Craig’s wonderful, page-turning storytelling will keep you up way past your time for bed.”",328,en,,
9780140443103,Orlando Furioso,Ludovico Ariosto,1991,ePenguin,Literary Criticism,"A dazzling kaleidoscope of adventures, ogres, monsters, barbaric splendor, and romance, this epic poem stands as one of the greatest works of the Italian Renaissance.",800,en,,
9780931089954,Teacher's Inspirations,Mac Anderson,1990,Great Quotations,Reference,A humorous collection of quotes and cartoons about the lighter side of life on the court.,84,en,,
9780553444872,Dragon's Eden,Glenna McReynolds,1995,Loveswept,Fiction,"Amid the lush and exotic beauty of a tropical island, cynical bounty hunter Jackson Daniels falls for a beautiful, silver-eyed temptress. Original.",227,en,,
9780312242619,The Usual Rules,Joyce Maynard,2003,Macmillan,Fiction,...The story takes place during September 11 Terrorist Attacks 2001...,412,en,5,2
9780439053860,A Coal Miner's Bride,Susan Campbell Bartoletti,2000,,Juvenile Nonfiction,"Sent from Poland to Pennsylvania to be married to a coal miner, thirteen-year-old Anetka lives a totally new life in a harsh environment she doesn't understand, in this latest addition to the Dear America series.",219,en,4.5,3
9780380619450,The Mosquito Coast,Paul Theroux,1986,Avon Books,Fiction,An American family's search for paradise becomes a fight for survival.,400,en,4.5,2
9781570711107,365 Days of Baby Love,"Sheila Ellison, Susan Ferdinandi",1996,,Family & Relationships,"Suggests activities involving art, language, music, movement, clay, water,nd food.",412,en,,
