ISBN,TITLE,AUTHORS,YEAR,PUBLISHER,GENRE,DESCRIPTION,PAGE_COUNT,LANGUAGE,AVG_RATING,RATINGS_COUNT
9780375759147,Little Dorrit,Charles Dickens,2002,National Geographic Books,Fiction,"Upon its publication in 1857, Little Dorrit immediately outsold any of Dickens’s previous books. The story of William Dorrit, imprisoned for debt in Marshalsea Prison, and his daughter and helpmate, Amy, or Little Dorrit, the novel charts the progress of the Dorrit family from poverty to riches. In his Introduction, David Gates argues that “intensity of imagination is the gift from which Dickens’s other great attributes derive: his eye and ear, his near-universal empathy, his ability to entertain both a sense of the ridiculous and a sense of ultimate significance.” This Modern Library Paperback Classic is set from the text of the 1857 edition.",0,en,,
9783423206457,Miss Clare erinnert sich,Miss ... Read,2003,,,,218,de,,
9780440120148,Devil's Guard,George R. Elford,1985,National Geographic Books,History,"The personal account of a guerrilla fighter in the French Foreign Legion, reveals the Nazi Battalion's inhumanities to Indochinese villagers.",0,en,,
9780609605141,What's Not to Love?,Jonathan Ames,2000,Crown,Biography & Autobiography,"""Jonathan Ames is one of the funniest writers in America,"" so says Jonathan Ames, who is actually writing this flap copy, which is the publishing industry term for the boastful fluff you read on the inner portion of most hardcover book jackets. So let the truth be known: Most writers write or at least rewrite their flap copy. And why not? They are writers after all. For the flap copy on my last novel, I had the audacity to pronounce that I was one of America's most talented young writers. My mother read that and was very proud, pointing it out to me. I then said to her, ""I wrote that."" But she was still proud; she probably didn't believe that I wrote it. In fact, she doesn't believe most of what I tell her, but that's probably because she couldn't take it if she did believe me. Which is a good way to describe this book, this comic autobiography: It's the kind of book one's mother shouldn't read, though there are several passages where I profess my great Oedipal love and desire for my mother, which she might find flattering. What else recommends this book, or, rather, what recommends me, since this book is about me. Well, I'm bald and ribald, I'm like Rabelais and Danny Kaye, sometimes I'm straight and sometimes I'm gay. Well, not really. I'm almost never gay, but it rhymed nicely with Kaye, and also I tend to be depressed rather than gay. But I do like to make others laugh, so if you're standing in a bookstore, I hope you'll find this book funny and I hope that you'll move on to my introduction, where I'll further implore you to keep reading, with the idea that you'll eventually purchase the book, which is the point, by the way, of flap copy.",296,en,5,1
9780140098921,Kangaroo,D. H. Lawrence,1987,Penguin Group USA,Fiction,"A critical edition of Kangaroo, D. H. Lawrence's eighth novel, set in Australia. Copyright © Libri GmbH. All rights reserved.",400,en,,
9780805064360,After the Darkest Hour,Kathleen A. Brehony,2001,Macmillan,Family & Relationships,""" ... the stories of people who have endured trials and consequently found deeper spiritual and psychological meaning in their lives ...""--Jacket.",294,en,,
9782841466894,Violences scolaires,"Pascal Vivet, Bernard Defrance",2000,,Adolescents maltraités - France,"Quand on évoque la violence à l'école, on a tendance aujourd'hui à stigmatiser les jeunes eux-mêmes : trublions, incivils, vandales, agressant leurs profs... Cette réalité existe, mais elle en cache une autre, bien plus pernicieuse : la violence - psychologique, physique ou sexuelle - subie par les enfants et les adolescents dans le cadre d'une institution censée les protéger. A partir de récits recueillis à un poste d'observation privilégié - un comité de prévention des mauvais traitements à l'égard des mineurs -, les auteurs analysent des cas de violence en milieu scolaire, sélectionnés pour leur caractère ordinaire : des histoires vécues par des enfants et des adolescents, qui permettent de lever le voile sur une réalité encore trop souvent dissimulée et de questionner la défaillance des adultes dans ces situations. Ils interrogent, de leur place respective (celle de l'enseignant ; celle du chargé de mission censé faire le lien entre l'institution scolaire, la collectivité locale et, le cas échéant, la justice), les difficultés des institutions à répondre efficacement à ces dérapages quotidiens. De la maternelle au lycée, cet ouvrage est un outil de prévention précieux pour les enseignants et les parents.",151,fr,,
9780446605632,Exchange Alley,Michael Walsh,1998,Warner Books (NY),Fiction,"The nude and sexually mutilated body of a Danish diplomat is found in upstate New York. When old-fashioned NYPD Detective Francis X. Byrne is brought into the case, he discovers the man was hiding a dangerous secret. Byrne must delve into the heart of contemporary urban darkness to uncover not only the killer, but the truth behind Lee Harvey Oswald and the KGB.",486,en,,
9780312957797,Casting in Dead Water,David Leitz,1996,St Martins Press,Fiction,"Anticipating a season of fly fishing and relaxation at a Vermont Lodge, Max Addams is alarmed when the arrival of a lumber company culminates in the death of hundreds of trout and the murder of a close friend. Original.",281,en,,
9780425089996,Elvis - The Final Years,Jerry Hopkins,1985,Berkley,Singers,"Even after his death, Elvis, the King, lives on in his music and in the memories of millions of fans. Finally, a book exposes the real Elvis--the star so many loved, but few truly knew. An extremely gifted man, very giving, and very, very human.",304,en,,
9781902825243,The Xenophobe's Guide to the Danes,"Helen Dyrbye, Steven Harris, Thomas Golzen",1999,Oval Projects Ltd,Australians,"Highlights the unique character and behavior of the nation. Frank, irreverent, funny--almost guaranteed to cure Xenophobia.",0,en,,
9780966517637,Championship Writing,Paula LaRocque,2000,"Marion Street Press, Inc.",Language Arts & Disciplines,"A fun-to-read guide to writing well from a beloved writing coach, LaRocque's work gently teaches how to write with creativity and flair.",212,en,,
9780525242314,Green Politics,"Fritjof Capra, Charlene Spretnak, Wulf-Rüdiger Lutz",1984,Dutton Adult,Nature,A history of the Green movement in Germany and their concern for the environment and nuclear disarmament.,278,en,,
9780671667498,Being the Best,Denis Waitley,1988,,Psychology,"Power, money, authority and influence are today's yardsticks for measuring success. Waitley replaces the myths of success with the profound values of integrity, discipline and determination and shows readers how to discover happiness in their inner selves.",276,en,,
9780521478090,Patterns and Processes of Vertebrate Evolution,Robert Lynn Carroll,1997,Cambridge University Press,Science,The factors that influenced the evolution of the vertebrates are compared with the importance of variation and selection that Darwin emphasised in this broad study of the patterns and forces of evolutionary change.,442,en,,
9780821741313,Delta Green,William H. Lovejoy,1993,Zebra Books,Fiction,"From the author of Delta Blue comes another fast-paced technothriller featuring the super-stealth skyfighters of the Delta Force. In the jungles of Cambodia, a massive military assault is being mounted against the forces of freedom, bringing the planet to the brink of disaster. Only one force can prevent rampant world destruction: Delta Green.",390,en,,
9780340394953,The British Airways Story,Duncan Campbell-Smith,1986,,"Aeronautics, Commercial",,327,en,,
9780340321201,The Fifth Hostage,Terence Strong,1983,,Great Britain,,352,en,,
9780670856404,The Fortune Teller's Mah Jongg,Derek Walters,1994,Penguin Putnam,Divination,"An enchanting novelty for anyone fascinated by Chinese culture, the game that has challenged players for centuries has been adapted for more mystical pursuits--predicting the future and imparting wisdom. Includes complete instructions and four decks of cards representing the traditional tiles.",0,en,,
9780373520770,The Bad-Girl Bride,Jennifer Drew,1998,Harlequin Treasury-Silhouette Yours Truly 90s,Fiction,"Julie's fiance broke off the engagement because she was too nice. Now her dress is for sale and she's looking for someone to teach her the wicked ways of love. All Tom wants is a wedding dress for his sister, Tina. But suddenly he finds himself tutoring a perfectly perfect woman on the virtues of being a temptress. And before his eyes, Julie starts to blossom--and to attract. And Tom realizes that, confirmed bachelor or not, he wants this bad-girl beauty for himself.",200,en,,
9780061082306,La Flamme,Constance O'Banyon,1995,HarperPrism,Fiction,"On the King's command, Lady Sabine Woolbridge was betrothed to Garreth Blackthorn, scion of a rival English family. But when her father was murdered by men wearing the Blackthorn crest, Sabine fled to Paris, where she became an actress known only as ""La Flamme"". Sabine's attempt at revenge would draw her close to Garreth, her enemy--yet her only true love.",390,en,,
9780812095371,Hamsters,Kate Petty,1989,,Golden hamsters as pets,An introduction to guinea pigs for one interested in that animal as a pet.,52,en,,
9780671685232,Secrets Can Kill,Carolyn Keene,1989,Pocket Books,Juvenile Fiction,Nancy goes undercover as a transfer student in an attempt to catch the elusive thief who is stalking the nighttime halls at Bedford High.,164,en,,
9780312246495,Katharine Hepburn,Joal Ryan,1999,St Martins Press,Biography & Autobiography,The century-spanning life of screen legend Katharine Hepburn is provided in 125 glorious black-and-white photographs.,207,en,,
9780345358646,The Lie of the Land,Haydn Middleton,1989,,Fiction,David Nunnies is a slave to a terrifying secret from his past--an event that cut him adrift from his wife and child and that now threatens to destroy his very life,281,en,,
9780373289110,The Norman's Heart,Margaret Moore,1996,Harlequin Treasury-Harlequin Historicals 90s,Fiction,"The Norman's Heart by Margaret Moore released on Feb 23, 1996 is available now for purchase.",356,en,,
9780385260077,Cat's Eye,Margaret Atwood,1989,New York ; Toronto : Doubleday,Fiction,"Elaine Risley, a successful artist, returns to Toronto, the city of her youth, to confront painful memories of the past.",472,en,5,1
9782070361038,Zazie dans le métro,Raymond Queneau,1959,,,,253,fr,,
9780802138200,Asleep,Banana Yoshimoto,2000,Grove Press,Fiction,"In these three novellas, Yoshimoto spins the stories of three young women bewitched into a spiritual sleep. Sly and mystical as a ghost story, with a touch of Kafkaesque surrealism, ""Asleep""--now in paperback--is an enchanting book from one of the best writers in contemporary international fiction.",196,en,4.5,2
9780449908587,The Happy Isles of Oceania,Paul Theroux,1993,,Travel,Hilarious travel account of novelist Theroux's trip to 51 Pacific islands.,536,en,,
9780152017682,The Dark-angel,Meredith Ann Pierce,1998,HMH Books For Young Readers,Fiction,The servant girl Aeriel must choose between destroying her vampire master for his evil deeds or saving him for the sake of his beauty and the spark of goodness she has seen in him.,310,en,4,2
9780448413105,The Mummy's Gold,Kate McMullan,1996,,Brothers,"Jake thinks that the mummy he meets at a movie theater is part of one of his brother's tricks, but he is wrong.",0,en,,
9780515134155,Maid of Killarney,Ana Seymour,2002,Jove Books,Fiction,"John Black, the doctor turned rebel from Seymour's acclaimed Riordan Brothers trilogy, returns home to Killarney, longing for peace and quiet. Just as he returns, Lily and her daughter try to ignore the whispers of the villagers who call them witches. When Lily's daughter is nearly drowned by three ruffians, John stays by the girl's side--and soon falls for the charms of her mother. Original.",276,en,,
9780709164647,Condominium,John Dann MacDonald,1977,Robert Hale,Fiction,"A first-rate entertainment (New York Daily News), Condominium is a panoramic novel from a master of suspense that follows the disappearance of an American paradise, the corrupt souls willing to sell out to make a buck, the innocent masses caught in their wake--and the perfect storm that washes everything away. Introduction by Dean Koontz Welcome to Florida's Golden Sands, the dream condominium complex built on a weak foundation and a thousand dirty secrets. The real estate was a steal--literally. The maintenance charges run high as the locals are run out. It's the home of shortcuts, crackdowns, breakups, oversights, and payoffs. Add it all up, and the new coastline community doesn't stand a chance against the ever-present specter of disaster: the dreaded hurricane. The big one is coming. Golden Sands is right in its path. And only a few brave souls have the power to stop this towering eyesore from going underwater for good. Praise for John D. MacDonald and Condominium Most readers loved John D. MacDonald's work because he told a rip-roaring yarn. I loved it because he was the first modern writer to nail Florida dead-center, to capture all its languid sleaze, racy sense of promise, and breath-grabbing beauty.--Carl Hiaasen A narrative of wracking suspense that mounts to a devastating climax.--Cosmopolitan John D. MacDonald created a staggering quantity of wonderful books, each rich with characterization, suspense, and an almost intoxicating sense of place.--Jonathan Kellerman",458,en,,
9780374189891,A Live Coal in the Sea,Madeleine L'Engle,1996,Farrar Straus & Giroux,Fiction,"Three generations of a family struggle with loyalty, commitment, and identity when Camilla Dickinson is confronted by her granddaughter, Raffi, with the news that her father has hinted that Camilla is not really her grandmother",323,en,,
9780373613748,The Billionaire Drifter,Beverly Bird,2003,Silhouette,Adoptees,"Billionaire Max Strong enjoys living far away from the glamour scene. But strange things begin to happen at his haven, including an unexpected run-in with beautiful stranger Honey Evans. Original.",0,en,,
9782277301004,Deux petites filles mortes,Stephen King,1996,J'ai Lu,,"Octobre 1932. Pénitencier d'Etat, Cold Mountain, Louisiane. A l'écart des autres, le bloc E. Celui des condamnés à mort. L'antichambre de l'enfer. Au bout du long corridor vert, la chaise électrique, Miss Cent Mille volts au répugnant baiser... Sa prochaine victime, John Caffey. Un géant. Le meurtrier des petites jumelles Detterick. Surpris devant leurs cadavres ensanglantés. Etrangement absent. Si calme... Paul, le gardien-chef, l'accueille comme les autres, sans états d'âme... Et pourtant... L'air est étouffant... Quelque chose se trame... Le regard troublant du condamné, les provocations sadiques de Percy Wetmore, une exécution de trop... ? Un rouage va lâcher. Mais lequel ? Pourquoi ? Et qui manipule Mister Jingles, cette étrange souris trop curieuse et trop savante ? Le suspense ne fait que commencer...",88,fr,,
9780515122770,Slocum and the Comely Corpse,Jake Logan,1998,Jove,Fiction,More information to be announced soon on this forthcoming title from Penguin USA,183,en,,
9780156010757,The Feeling of what Happens,Antonio R. Damasio,1999,Houghton Mifflin Harcourt,Medical,"A new theory of consciousness and the construction of identity focuses on the body's reaction to its world, postulating that a complex relationship between body, emotion, and mind is required to configure the self.",404,en,,
9780061001420,Almonds and Raisins,Maisie Mosco,1991,HarperPrism,Fiction,"The families are as different as night and day. The outgoing Sandbergs are from Russia, while the bookish Moritzes are from Austria. They meet in England before the First World War and form a strong, fiery friendship that would shape the destinies of three generations.",484,en,,
9780029037614,The Tempting of America,Robert H. Bork,1990,,Law,Judge Bork offers a statement of his social and legal philosophy.,458,en,,
9780306804465,Piece of My Heart,David Dalton,1991,Da Capo,Biography & Autobiography,"In 1972, Stonehill Books published David Dalton's Janis, a multimedia extravaganza that incorporated interviews, quotes, photographs, lyrics, Rolling Stone Clippings, sheet music, a record of rapping and singing, and prose as wild and moving as Janis's performances. Piece of My Heart is a reconstruction and revision of that early work - one of the first ""rock 'n' roll"" books—leaving the prose and interviews intact, adding dozens of new photos, and incorporating a wealth of new material. Here is the best possible portrait of the lonely teenager from Port Arthur, Texas, who took the blues farther than anyone before or since, offering revealing glimpses of her on the road—backstage with Jerry Lee Lewis, kidnapped in Kansas, partying with the Grateful Dead, the Band, Bonnie and Delaney, and with her own band, Big Brother and the Holding Company. But Piece of My Heart goes beyond Janis's own story to provide us with a portrait of the Kosmic Blues themselves—the self destruction that lies at the heart of the rock' n' roll myth.",284,en,,
9780140322576,The Double Life of Pocahontas,Jean Fritz,1983,Puffin Books,Juvenile Nonfiction,"A biography of the famous American Indian princess, emphasizing her life-long adulation of John Smith and the roles she played in two very different cultures.",100,en,4,1
9780312119324,Where Do You Stop?,Eric Kraft,1995,Macmillan,Fiction,"""Where do you stop?"" is the question posed by Miss Rheingold, the intoxicating new teacher of Peter Leroy's junior high school class. That question forms the basis of a science paper that Peter spends thirty years trying to complete-along the way exploring quantum physics, entropy, epistemology, principles of uncertainty and discontinuity, and a range of Life's Big Questions. Deceptively simple and warmly engaging, Eric Kraft's novel is an ingenious portrait of a small American town in the 1950s, when the atom seemed to hold the key to the mystery of creation, as well as the power to utterly destroy it.",190,en,,
9780451176752,No Way Home,Andrew Coburn,1993,Signet Book,Fiction,"New York Times bestselling author Coburn (Goldilocks) returns with what Newsweek calls ""one of the best suspense novels"" of the summer. This tense tale of deadly rage and jagged justice in a small Massachusetts town introduces Coburn's new protagonist, police chief James Morgan.",360,en,,
9780802711694,Your Child's First School,Diana Townsend-Butterworth,1992,Walker & Company,Education,"Gives parents the facts necessary to make sound choices about their children's education, discussing options in education, what to look for in a school, what questions to ask, and finding a perfect match between child and school",271,en,,
9788483100356,Yo no tengo la culpa de haber nacido tan sexy,Eduardo Mendicutti,1997,TusQuets,Fiction,"La desternillante aventura de una mujer muy especial en su camino hacia la santidad, o su perdición. Rebecca de Windsor, una hermosísima mujer dedicada al espectáculo, descubre un día ante el espejo que el tiempo empieza a hacer mella en su cuerpo. Ella, que siempre ha sabido imponerse al destino y siempre ha querido (y logrado) ser la primera en todo, no puede permitirse el lujo de no encontrar la vía más digna hacia una madurez superior, y decide emprender el camino de la santidad, elevarse por encima de los demás mortales y alcanzar las cimas sólo holladas por los místicos. Todo ello entraría en la más absoluta normalidad, si no fuera porque Rebecca de Windsor fue durante treinta y siete años de su vida Jesús López Soler y porque nadie, ni siquiera ella, escapa a las muchas trampas de la memoria.",292,es,,
9780749931889,Mother Love,Martine Oborne,2000,Piatkus Books,Parenting,"High flyer Louise Atlas has a demanding city career and an equally demanding family. Disaster strikes when, in the middle of a crucial deal, her sister dumps her baby daughter on her to go and find herself, and her perfect nanny quits. But she can handle four small children - can't she?",394,en,,
9780312265793,The Dutch,Les Roberts,2001,Macmillan,Fiction,"Milan Jacovich, Cleveland's most popular private investigator, specializes in industrial security, but when another type of case comes up that is too good to resist he will agree to work on it. That is exactly what happens when Professor Carnine walks into his office in this 12th addition to the series. Milan recognizes Dr. Carnine's name, but can't remember from where until Dr. Carnine explains. His daughter's body was found under a local bridge. The police agreed that 30-year-old Ellen Carnine committed suicide, or in street parlance ""did the dutch."" However, Dr. Carnine cannot accept that answer and wants Milan to find out what could have driven his daughter, somewhat of a recluse, to take her own life? He is filled with guilt that maybe there was something about his daughter he should have known, that maybe there was a way he could have helped her. Reluctantly, Milan agrees to take the case knowing that the outcome will not be happy for anyone. Milan finds that Ellen spent most of her time on the computer either working or on the Internet and that she was appreciated by her bosses, a pair of young Cleveland entrepreneurs who made movies. But interviews with her few friends lead him to see her as an independent person who got satisfaction from her work and had accepted the fact that she was seriously overweight and physically unattractive. Digging further, Milan comes upon upsetting small clues that shout ""murder"" to him, and suspicions about what her employers were actually up to grow. His investigation begins to take a different, and eventually dangerous, direction until he uncovers the horrific truth behind Ellen's death.",312,en,,
9781889195162,Most Art Sucks,Tom Patchett,1998,,Art,"Dubbed ""the National Enquirer of the Art World"" by the New York Post, Coagula Art Journal stands alone among art publications in its iconoclastic, irreverent commentary on the New York and Los Angeles art scenes. This compendium of the ""best of"" Coagula presents exposés, gossip, and insider dirt about the art-world elite; articulate essays about contemporary artists ranging from Bob Flanagan and Lari Pittman to Gilbert & George and Carolee Schneeman; insightful interviews with influential art-world players, including the Museum of Modern Art's Robert Storr, Newsweek's Peter Plagens, and Beat Generation legend George Herms; and its trademark satire of art-world pretensions with the energy and style of underground zines and the investigative style of tabloid journalism.",212,en,,
9780760730300,Cat Abroad,Peter Gethers,2001,,Cat owners,"The Cat Who Went to Paris: Two pet owners tell of their talented animals in relaxed, entertaining ways. Gethers's style is extremely light and at times funny as he tells how Norton taught him to like cats, how easily this feline made friends with airline crews, explored Parisian rooftops, and stood vigil at the death of his owner's father. Blind actor-musician Tom Sullivan relates, through White, how he had to let Dinah train him as she was so much more capable than his previous guide dog. -- A Cat Abroad: He's back as a celebrity now--Norton the adorable Scottish fold cat whose adventures were chronicled by Gethers in The Cat Who Went to Paris (LJ 9/1/91). Norton the star now dines on Pounce pizza prepared by superstar chef Wolfgang Puck, stays in a famous New Orleans hotel that has a no-pets policy, tours the United States on the TV talk-show circuit, and receives fan mail and photos from humans as well as cats. Most of this book describes Norton and Peter's year in Provence, where Norton's days in a beautiful 300-year-old country home are filled with naps in the garden, exploring the neighborhood, and more napping in the lap of his human.",472,en,,
9780671469450,Woman's Day Book of Baking,,1983,,,,263,en,,
9781860645884,"Mary, Queen of Scots",Jenny Wormald,2001,Tauris Parke Paperbacks,Biography & Autobiography,"Mary, Queen of Scots, was one of history's most romantically tragic figures. Her endless plotting eventually led her to flee from Scotland and be imprisoned by her equally ambitious cousin and fellow queen--Elizabeth of England--who later ordered Mary to be beheaded in 1587. This book looks at her tragedy. of photos.",216,en,,
9780140097436,"Yo, Poe",Frank Gannon,1988,,Wit and humor,,14,en,,
9780440177043,Season of Passion,Danielle Steel,1979,Dell,Fiction,"Kate is only eighteen when she meets Tom Harper, one of America's biggest pro-football stars. They share an idyllic and glamorous first love. But the bullet that suddenly ends Tom's career also ends their life together. A failed suicide attempt will leave him mentally and physically disabled forever. Kate will be left alone, heartbroken, and pregnant with their son. Soon she will have another chance at love, but it will mean learning to let go of the past and learning to trust again.",436,en,5,1
9780966645910,Will Work for Peace,Brett Axel,2000,,Political poetry,,240,en,,
9781569471470,Much Younger Man,Dianne Highbridge,2003,,Middle-aged women,"In Australia, a schoolteacher falls in love with a youth, 20 years her junior. The heroine is Aly, 36, a divorced woman, while he is Tom, 16. He is the son of her best friend. When the community discovers their affair it turns against her.",0,en,,
9783442724055,Das Krallenäffchen,Sigrid Nunez,2001,,,,157,de,,
9780671451523,Animals at the Zoo,Kenneth Lilly,1982,Atheneum,Zoo animals,"Illustrates and names zoo animals including lion and cub, panda and baby panda, chimpanzee and baby chimpanzee, giraffe and calf, hippopotamus and calf.",10,en,,
