ISBN,TITLE,AUTHORS,YEAR,PUBLISHER,GENRE,DESCRIPTION,PAGE_COUNT,LANGUAGE,AVG_RATING,RATINGS_COUNT
9780440225775,The Uncanny,Andrew Klavan,1998,Island Books,Fiction,"Richard Storm is passionate, hot-blooded, and running out of time. Sophia Endering is cool, beautiful, and haunted by a centuries-old mystery. Now the Hollywood filmmaker and the troubled young woman have come together in a race against the unbelievable, the unthinkable, and. . . The Uncanny. Richard Storm reached the top of his profession producing horror films based on classic English ghost stories. Now, with his life beginning to unravel, Richard is searching for something to believe in. Fleeing Hollywood for London, he embarks on a desperate quest: to find evidence that the great old stories bear some truth, that the human spirit lives on after death. What he finds is Sophia, a woman caught in a nightmare more chilling than any of his film horrors. Propelled by a furious love, haunted by a terror he can barely confess to himself, Storm pursues Sophia through the labyrinth of her family's madness and their involvement in Nazi art thefts, down a trail formed by the classic ghost stories themselves--into the very heart of the uncanny. . . .",415,en,,
9788437220437,El niño de Hiroshima,"Isoko Hatano, Hatano Ichiro",1984,,Spanish language,,200,es,,
9780394512389,From a Limestone Ledge,John Graves,1980,Alfred A. Knopf,Biography & Autobiography,"With the same craft and wit, the highly acclaimed author of Goodbye to a River and Hard Scrabble here writes about nature and man on his own rough ""patch"" of Texas land. Unsentimentally, gracefully, with a true countryman's earthly good sense, John Graves talks about cows, bees, goats, about the satisfaction of making (and drinking) wines, about snuff and chewing tobacco, about the landscape and thee living. From a Limestone Ledge is a celebration of ""the casual but constant observation of detail, the noticingness of a rural life,"" a treatise on the pleasures and hardships of doing things for oneself, a nostalgic meditation on country ways. At once encyclopedist and raconteur, Graves shares a compulsion to hoard junk, his stubborn refusal to raise chickens the right way, and his preference for visiting, and not living with, goats. In his work, described by the Boston Globe as ""civilized, funny, humane,"" Graves considers every creature and aspect of country life that has lured--or forced-- his attention during two decades of living on, and working, a battered and recalcitrant stock from in the cedar-covered limestone hills of North Central Texas. From a Limestone Ledge will have the deep appreciation of Graves' earlier readers and will win, for his self-reliant way of life as well, new enthusiasts -- Book jacket.",266,en,,
9781559707022,Balthasar's Odyssey,Amin Maalouf,2003,,Merchants,"It is 1665, and all the signs and portents foretell that next year the Antichrist will appear and the world will come to an end.Antiquarian merchant and sage Balthasar sets out in search of a rare book that may bring salvation to a distraught world, a mysterious work entitled The Hundredth Name.In the course of his odyssey throughout the Mediterranean and beyond, Balthasar travels through countries in ruin, cities in flames, and stricken communities awaiting the Apocalypse. He encounters fear, falsehood, and disillusion, but he also discovers love at a time when he had given up all hope.",0,en,,
9781583141441,True Love,Brenda Jackson,2000,Harlequin Kimani,Fiction,"Shayla Kirkland is prepared to destroy Chenault Electronics until she meets the handsome CEO, Nicholas Chenault.",324,en,,
9780826332035,A Flower in the Desert,Walter Satterthwait,2003,UNM Press,Fiction,"Looks at a potentially explosive situation, in which genetically modified plants have become part of our daily diet, without consumer awareness or knowledge of potential risks. Asks whether food crops, a vital element of the collective wealth of this planet, should remain at the mercy of private interests.",260,en,5,1
9780711701779,The Real World of Beatrix Potter,"Elizabeth Battrick, National Trust (Great Britain)",1994,,"Children's stories, English",,64,en,,
9780091828523,Telling Lies for God,I. R. Plimer,1994,,Philosophy,"This controversial analysis of creationism examines the arguments put forward to support the acceptance of a literal interpretation of the Biblical account of creation, and presents counterarguments from a scientific viewpoint. Also critically examines the material that many creationists use to support their beliefs. Includes a bibliography. The author is professor of geology at the University of Melbourne.",328,en,,
9780345416445,Sarah Canary,Karen Joy Fowler,1998,,Fiction,"When an enigmatic woman cloaked in black wanders into a Chinese labor camp in the Pacific Northwest of 1873, one man is chosen to lead her out into the woods. But soon, he becomes the enchanted follower. Thus begins a magical journey. . . .",324,en,,
9780064409056,The Nightmare Room #7: The Howler,R.L. Stine,2001,HarperCollins,Juvenile Fiction,"You hold in your hand the key to a shadow world of shivers and screams. Take a step away from the safe, comfortable world you know. Unlock the door to terror. There's always room for one more in...The Nightmare Room. Spencer Turner is a major electronics geek, and he's just purchased a cool new gadget called The Howler. It's supposed to allow Spencer to pick up the howls of ghosts and spirits. Spencer would love to communicate with the spirit world. He can't wait to see if it works. Unfortunately, Spencer soon hears his own howls of horror -- because when he turns on The Howler, he opens a channel to The Nightmare Room. What will you find in The Nightmare Room next time? Check out book 8: Shadow Girl.",164,en,,
9780805047011,The Primary Colors,Alexander Theroux,1996,Owl Books,Art,"A fascinating cultural history, these splendid essays on the three primary colors--blue, yellow, and red--extend to the artistic, literary, linguistic, botanical, cinematic, aesthetic, religious, scientific, culinary, climatological, and emotional dimensions of each color. QBPC Selection.",268,en,,
9780399508059,The Artist's Silkscreen Manual,Andrew B. Gardner,1982,Perigee Books,Architecture,,164,en,,
9780528803772,Are We There Yet?,"Rand McNally, Rand McNally Staff",1990,,Juvenile Nonfiction,,52,en,,
9780553219104,Made for Each Other,Doris Parmett,1988,Loveswept,,,212,en,,
9780940450073,Mark Twain: Mississippi Writings (LOA #5),Mark Twain,1982,Library of America,Fiction,"This Library of America collection presents Twain's best-known works, including Adventures of Hucklebery Finn, together in one volume for the first time. Tom Sawyer “is simply a hymn,” said its author, “put into prose form to give it a worldly air,” a book where nostalgia is so strong that it dissolves the tensions and perplexities that assert themselves in the later works. Twain began Huckleberry Finn the same year Tom Sawyer was published, but he was unable to complete it for several more. It was during this period of uncertainty that Twain made a pilgrimage to the scenes of his childhood in Hannibal, Missouri, a trip that led eventually to Life on the Mississippi. The river in Twain’s descriptions is a bewitching mixture of beauty and power, seductive calms and treacherous shoals, pleasure and terror, an image of the societies it touches and transports. Each of these works is filled with comic and melodramatic adventure, with horseplay and poetic evocations of scenery, and with characters who have become central to American mythology—not only Tom Sawyer and Huck Finn, but also Roxy, the mulatto slave in Puddn’head Wilson, one of the most telling portraits of a woman in American fiction. With each book there is evidence of a growing bafflement and despair, until with Puddn’head Wilson, high jinks and games, far from disguising the terrible cost of slavery, become instead its macabre evidence. Through each of four works, too, runs the Mississippi, the river that T. S. Eliot, echoing Twain, was to call the “strong brown god.” For Twain, the river represented the complex and often contradictory possibilities in his own and his nation’s life. The Mississippi marks the place where civilization, moving west with its comforts and proprieties, discovers and contends with the rough realities, violence, chicaneries, and promise of freedom on the frontier. It is the place, too, where the currents Mark Twain learned to navigate as a pilot—an experience recounted in Life on the Mississippi—move inexorably into the Deep South, so that the innocence of joyful play and boyhood along its shores eventually confronts the grim reality of slavery. LIBRARY OF AMERICA is an independent nonprofit cultural organization founded in 1979 to preserve our nation’s literary heritage by publishing, and keeping permanently in print, America’s best and most significant writing. The Library of America series includes more than 300 volumes to date, authoritative editions that average 1,000 pages in length, feature cloth covers, sewn bindings, and ribbon markers, and are printed on premium acid-free paper that will last for centuries.",1190,en,4,1
9780399138591,Howard Hughes,Charles Higham,1993,Putnam Adult,Biography & Autobiography,Biography of millionaire businessman Howard Hughes discussing his public and private life.,392,en,,
9780394710198,The Blood of an Englishman,James McClure,1982,Pantheon,Fiction,,278,en,,
9780877478409,Getting to Know the Real You,"Sterling G. Ellsworth, Richard G. Ellsworth",1980,,Religion,,182,en,,
9780664257552,Meditations on the Cross,Dietrich Bonhoeffer,1998,Westminster John Knox Press,Religion,The cross and the resurrection were central themes for Bonhoeffer's theology. These excerpts from sermons and letters contain his personal and faithful words about the crucifixion and the power of the cross for all Christians. Meditations on the Cross is ideal for devotional reading and personal reference.,0,en,,
9781552790113,Beneath the Plains of Abraham,Kim Kinrade,1998,Picasso Publications,Fiction,"Prime Minister Jason Alexander Carruthers has the unenviable task of leading his country through what becomes a civil war. Gilles Beauchamp, the leader of Quebec separatists, has used technology to rig the results of a Canadian referendum, ensuring that Quebec will separate. Beauchamp begins military training, and Carruthers is forced to prepare for Canada's first civil war. Sabotage, murder, and chaos leave the country gripped with fear and all wondering if peace has a chance.",530,en,,
9780943358055,Synastry,Ronald C. Davison,1983,,Astrology,"Astrology can be used as a valuable tool in the understanding of human relationships. This internationally acclaimed book lays the foundation for a comprehensive study by giving a basic view of the principles of chart comparison and interpretation, showing how to apply this information. The author has discovered ""The Relationship Horoscope"", an entirely new way of charting, in a single horoscope, the relationship between two people. He also introduces new methods of determining the quality of that relationship. Essential energy patterns and needs are first determined within the natal chart and then various methods of comparing horoscopes are fully explained. Twenty horoscopes further illustrate how to utilise this rich source of information. Whether you are a professional Astrologer or simply learning more about your own innate potential, this book offers information, and guidance that will enrich your insight into relationships and increase self-knowledge. Topics include: Marriage & Relationships; The First Meeting Horoscope; Various Methods of Comparison; Sun Sign Compatibility; The Part of Marriage; Planetary Cross Aspects; House Interchanges; The Relationship Horoscope.",0,en,,
9780345375650,The Spitfire,Bertrice Small,1992,,Great Britain,"""Realistic, appealing characters and an entertaining tale."" PUBLISHERS WEEKLY The year is 1483. Just as beautiful Lady Arabella Grey, the young cousin of England's King Richard III, speaks her wedding vows to Sir Jasper Keane, the Scotsman Tavis Stewart, Earl of Dunmore, abducts Arabella as payment for Jasper's murder of his fiancee. Irresistibly, deliciously, Arabella surrenders to her enemy with fierce abandon--knowing that there may be only one way to get what is rightfully hers....",0,en,,
9780385318174,A Year and a Day,Virginia Henley,1998,New York : Delacorte Press,Fiction,"From ""New York Times bestselling author Virginia Henley, whose romantic novels have enchanted readers worldwide, comes her most tempestuous and emotional love story to date, the tale of an innocent Scottish maiden and a battle-scarred English baron who is desperate to have a child. As Edward Plantagenet's armies invade Scotland, Lynx de Warenne, one of the king's most prized warriors, is ordered to secure the royal castle at Dumfries in the crucial borderlands. There he encounters Jock Leslie, the castle's steward, a man with ten children and thirty-one grandchildren, who might have the means of fulfilling Lynx's greatest desire. A thirty-year-old childless widower, Lynx wants more than anything a child who will brighten his life, carry on the de Warenne name, and maintain the family's landholdings. Yet he is a man who is afraid to love and is haunted by the possibility that he is unable to sire a child. When Jock learns of Lynx's desire to become a father, he suggests a handfasting, a Scottish custom whereby a man and a woman can lawfully sleep together for a year and a day, at the end of which time the couple decides either to wed or to part. If the union produces a child, the child is deemed legitimate even if no marriage takes place. When Jock offers Lynx his youngest, most strong-willed daughter, Jane, so desperate is Lynx to mate with a member of the fertile family that he engages Jane in a handfasting--no matter that she is a commoner, no matter that she is terrified of him and attempts to make herself unattractive to him in the extreme, no matter that she is completely inexperienced with men. With incomparable erotic tension, humor, and narrative verve, VirginiaHenley brings together these two unlikely romantic partners in an unforgettable story about the power of love and family.",420,en,,
9780932445148,Tom O'Bedlam's Night Out and Other Strange Excursions,Darrell Schweitzer,1985,,Fiction,,200,en,,
9780679640929,The Catholic Church,Hans Küng,2001,,Religion,Offers a brief history of the Catholic Church from its roots in the teachings of Jesus Christ to the present day.,264,en,,
9780521297769,"Reason, Truth and History",Hilary Putnam,1981,Cambridge University Press,Philosophy,"'This is a timely book, with penetrating discussion of issues very much in the forefront of the contemporary philosophy. Despite the prominence of negative arguments it contains much to contribute positively to our understanding of what is needed for a conception of rationality and objectivity that covers ethics and value theory generally as well as physics.'",244,en,,
9780192717573,Rosie No-Name and the Forest of Forgetting,Gareth Owen,1997,,Amnesia,Eleven-year-old Rosie fights for her life after she falls through the crumbling stairway in a mysterious old house.,109,en,,
9781410703989,An Elephant in Wyoming,Matt Mihovich,2003,,Fiction,"Set in the near future, AN ELEPHANT IN WYOMING chronicles the diary entries of an old man backpacking in the Wind River Range. Why he's there and what he experiences will provide controversial reading especially for baby boomers.",276,en,,
9780571152469,The Balcony,Jean Genet,1991,,French drama Twentieth century. Critical studies,"One of a series of titles first published by Faber between 1930 and 1990, and in a style and format planned with a view to the appearance of the volumes on the bookshelf. Against the background of a revolution, Genet's play is set in a brothel designed for the fulfilment of any conceivable fantasy.",96,en,,
9781565923164,Windows 95 in a Nutshell,"Tim O'Reilly, Troy Mott",1998,O'Reilly Media,Computers,"With this title, readers will gain a complete understanding of the Windows 95 operating system and feel comfortable with modifying any aspect of it, using the Command Line from the DOS or Run prompt, the Explorer, the Registry, the Control Panel, or any other tool or application that exists in Windows 95.",542,en,,
9780385489782,Life on the Line,Solange De Santis,2000,,Automobile industry workers,,292,en,,
9780449214688,Not Quite Paradise,"Bonnie Maslin, Yehuda Nir",1988,Fawcett,Family & Relationships,"""A fresh start for couples in gaining understanding for each other."" Publishers Weekly Discover how a troubled marriage can be saved -- and how a good marriage can become even better! In this book you will learn how to recognize the symptoms of a marriage at risk and how to master a new language of love for a more gratifying and fulfilling relationship.",260,en,,
9781878424488,The Four Agreements Companion Book,"Don Miguel Ruiz, Janet Mills",2000,National Geographic Books,Self-Help,"The Four Agreements introduced a simple, but powerful code of conduct for attaining personal freedom and true happiness. Now The Four Agreements Companion Book takes you even further along the journey to recover the awareness and wisdom of your authentic self. This companion book is a must-read not only for those who enjoyed don Miguel’s first book, but for anyone who is ready to leave suffering behind, and to master the art of living in our natural state: happiness. The Companion Book includes: • How to break the domestication that keeps you enslaved by fear • Keys to recover your will, your faith, and the power of your word • Practice ideas to help you become the master of your own life • A dialogue with don Miguel about living The Four Agreements • Success stories from people who have used The Four Agreements “The Four Agreements are a tool for transformation, leading you to stop judging, mainly yourself, and to start practicing another way of life.” — don Miguel Ruiz",0,en,,
9780380977932,T2: The Future War,S.M. Stirling,2003,HarperEntertainment,Fiction,"The future war is now. Hiding out in Alaska, Sarah and John Connor, along with ex-counterterrorist agent, Dieter von Rossbach, are playing a waiting game -- trying to live their lives but ever watchful of Cyberdyne Corporation and the possibility of Skynet, the artificial intelligence network destined to destroy the world as we know it. They've fought for years to prevent this, and now, believing that John's love, Wendy, sacrificed herself to successfully prevent Skynet from becoming sentient, they think humanity may finally have a chance to survive. Then the United States government announces that all military and communications systems will be placed under the command of a brand-new, extremely powerful Artificial Intelligence named Skynet, effective immediately. Racing desperately to alert their allies, the Connors discover that Wendy's sacrifice was in vain -- far from being harmless, Skynet is active, sentient, and ready to terminate the human nuisance once and for all. Engineered by the relentless AI, the apocalypse of Judgment Day turns cities into deathtraps and releases mass destruction across the globe. In the nuclear winter that follows, our world changes forever: Cities become deathtraps of disease and famine patrolled by implacable machines, the first Hunter-Killer and T-90 Terminator units begin to exterminate their human prey, and all human life faces a desperate battle for survival against a seemingly unstoppable enemy. But there is still one rallying cry of hope, one man who will step to the forefront of the long fight to keep humanity from extinction: John Connor. A well-regarded author of alternate history sf novels, S. M. Stirling has written more than twenty-five books, including acclaimed collaborations with Anne McCaffrey, Jerry Pournelle, and David Drake. His most recent novels are T2®: Rising Storm, T2®: Infiltrator, The Conquistadors, and The Peshawar Lancers.",368,en,,
9780883680957,Foxe's Book of Martyrs,John Foxe,1981,Whitaker Distribution,Christian martyrs,Explore the lives of historical martyrs.,0,en,,
9780373023042,Bitter Enchantment,Yvonne Whittal,1979,Harlequin Treasury-Harlequin Romance,South Africa,"Bitter Enchantment by Yvonne Whittal released on Nov 24, 1979 is available now for purchase.",196,en,,
9780078811821,Oracle DBA Handbook,Kevin Loney,1994,McGraw-Hill Companies,Computers,"This handbook is ideal for all new and experienced database administrators who need to learn to manage a networked Orcale database system efficiently and effectively. The book opens with database architecture and setting up a database, before covering management and supporting packages. Readers will find a command reference, configuration guidelines, plus scripts and tips to help them set up a database. (Database Management)",710,en,,
9783404242757,Freitag,Robert A. Heinlein,2000,,,,510,de,,
9780830633340,24 Woodturning Projects,Percy W. Blandford,1990,,Technology & Engineering,Woodworkers can put to the test the knowledge and skills they gain from The Woodturners Bible with this collection of challenging projects for the home lathe.,126,en,,
9780753504567,Losing My Virginity,Richard Branson,2000,Virgin Books Limited,Businessmen,"An autobiography of entrepreneur, Richard Branson. It discusses Branson's family, friends and philosophy, and covers dramatic events such as his Atlantic crossings, the sale of Virgin Records and the BA dirty tricks affair. There are also insights into the workings of Virgin.",535,en,,
9780373036066,The Marriage Bargain,Susan Fox,2000,Harlequin Treasury-Harlequin Romanc,,"The Marriage Bargain by Susan Fox released on Apr 24, 2000 is available now for purchase.",0,en,,
9780373217472,Shotgun Vows,Teresa Southwick,2004,Silhouette,Fiction,"Matilda Fortune transforms herself from wallflower to tempting beauty to attract Dawson Prescott. But after a night of passion leaves them married, Matilda must convince Dawson that their shotgun vows are filled with the promise of love. Original.",260,en,,
9780061053207,Brand New Cherry Flavor,Todd Grimson,1997,Eos,Fiction,"Lisa Nova has it all talent, brains, beauty, and a mean streak to match. When her thirst for revenge introduces her to a thousand-year-old Mayan witch doctor, she discovers to her delight a bizarre, erotic link to the afterworld. When a totally hip Hollywood meets a harrowing ancient ritualistic curse, anything can happen and does in this extravagant novel.",356,en,,
9783442446902,Der Bruchpilot,Mark Childress,2000,,,,479,de,,
9781860464652,Midnight in Sicily,Peter Robb,1998,Harvill Press,History,,342,en,,
9780821718872,The Pacific Naval Battles,"Charles E. Pfannes, Victor A. Salamone",1986,Zebra Books,"World War, 1939-1945",,272,en,,
9780688088057,The Hole in the Flag,Andrei Codrescu,1991,William Morrow,History,"A Hole in the Flag is both a chronicle of the changes that have taken place in Romania over the past year, and a personal portrait of a man and his emotional attachment to his mother country--a poetic look at joy and disappointment.",260,en,,
9780879830687,The Healing Benefits of Acupressure,Francis M. Houston,1974,Keats Publishing,Acupressure,Shows how the simple application of finger pressure to specific points of the body can stimulate and alleviate many common ailments.,96,en,,
9780553099867,Jubilee Time,Maria Harris,1995,Bantam,Religion,"Starting with the biblical teaching that the 50th year marks a time for celebration and reflection, Harris helps women enter the second half of life with a refreshed spirituality, increased freedom, and a richer sense of themselves.",260,en,,
9781555833732,If Only for One Nite,James Earl Hardy,1997,,Fiction,"At his ten-year high school class reunion, Mitchell Crawford confronts his first love, his gymnastics coach Warren Reid.",216,en,,
9780310702962,Basketball,Mark Littleton,2002,Zondervan,Juvenile Nonfiction,Recounts the lives and careers of six professional basketball players who are known for their Christian faith as well as for their accomplishments on the court.,110,en,,
9780679861829,Bitty Goes to School,Elizabeth Greenaway,1994,Random House Books for Young Readers,Juvenile Nonfiction,"A kitten looks forward her first day of school, but when it arrives, she has some adjusting to do.",28,en,,
9780671026851,Savannah,Linda Lael Miller,1999,Pocket Books,Bars (Drinking establishments),"A young girl helps a gruff doctor deliver a baby during a stagecoach ride and in the months that follow, they become attracted one another.",0,en,,
9780671537630,Dr. Spock's Baby and Child Care,"Benjamin Spock, Steven Parker",1998,,Family & Relationships,"The standard guide to baby and child care, from physical to moral development, includes new material on computers and the Internet and on non-traditional families.",978,en,,
9780060957902,Tales of H.P. Lovecraft,Howard Phillips Lovecraft,2000,Harper Collins,Fiction,One of America's leading novelists pays tribute to horror genre master H.P Lovecraft in this collection of Lovecraft's finest works.,356,en,,
9780441664092,The Pimpernel Plot,Simon Hawke,1984,Ace Books,Space and time,,211,en,,
9780373029419,Whirlpool of Passion,Emma Darcy,1988,Harlequin Treasury-Harlequin Romance,Fiction,"Whirlpool Of Passion by Emma Darcy released on Sep 24, 1988 is available now for purchase.",196,en,,
9781856985208,Factbook of History,Books Mimosa,1993,Random House Value Publishing,"Chronology, Historical",,240,en,,
